"Ini pasti salah Jokowi, Ahok dan kafir-kafir ateis. https:\/\/t.co\/v2GRcUeStI"
@fahmiabuazzam1 biar aja biar tai nya kena bapak lo itu ya. Loh tuh kan gak suka sm ahok jadi biar loh sm bpk loh sm ibu loh kena tai nya.
RT @BungWinar: Angin memporakporandakan basis pemenangan Si Penista Agama...Cililitan.\nYa Alloh Ampuni Kami\n#JakartaBanjir
"RT @Lupuz0503: Prestasi Ahok, \nSelain mjadi mafia koruptor n penista agama, dirinya bhasil tenggelamkan JKT MELALUI congoran CEBON"
Ulama Kompak Nyatakan #HaramPemimpinKafir Pilih Ahok = Murtad!
KAU PENDIKAN TINGGI TAPI BODOH....GK ADA LARANG BAWA AGAMA..BIAR ORANG ISLAM YG DI BAYAR AHOK SADAR GK JADI MILIH AHOK GLA
@indopoints di tanah abang cina udah mulai resah dan stres gara2 si penista agama dan pilkada pasar jd sepi. Sepi sampai 2 minggu lg ha. ha
@investigator_RI betul dan semua pihak yg menentang si cina kafir ahok akan di kriminalisasi oleh polisi dgn smua rekayasa hukum nya
@YohanesTarigan9 saya ga habis pikir kenapa fanboy ahok bego bego ya pada ga ngerti sejarah. Gampang kejebak iklan. Maaf ya.
@Zufrianto3 lebih baik pilih ahok drpd pilih yg se iman tp koruptor dn munafik !! Bodoh kau
Ahok si penghina Al - Qur'an dan Ulama ini selalu bersikap menjijikkan yaitu sok suci dan merasa paling benar https:\/\/t.co\/bTkCeTNk0g
"Ayo umat Islam yg pinter, jgn percaya klo aksi 112 tdk ada hubungannya dgn pilkada, pihak AHY yg bayar anies yg untung \ud83d\ude01"
#DebatFinalPilkadaJKT mampuuuusssssss mpoK Silvy!!!!
Hidup china komunis ! https:\/\/t.co\/b1RheVKrXl
Ini tuh kesalahan Jokowi dan Ahok si babi ateis. https:\/\/t.co\/v2GRcUeStI
Kalo ahok menang pilkada bikin video sex bareng anaknya dong tan.? https:\/\/t.co\/7msmThwwLK
Keluarga Besar Kami Yang Berdomisili di Jakarta TIDAK PILIH AHOK!! https:\/\/t.co\/GZKZFTpvCw Suara Ulama Bulat! #HaramPilihAhok #JanganGolput
ketutunan cina dari luar kota dan pulau mulai kejakarta mau coblos ahok dengan KTP aspal dari kamboja
RT @indopoints: china babi... china maling...\n#UsirChina https:\/\/t.co\/9y4HIWHJp2
RT @mosangada72: Masih mau memilih Agus-Sylvi???\nAnaknya SBY dan Keluarga Koruptor\n#BlusukanAhok\n#BerjamaahCoblosPecinya\u2026
tangkap ahok dan klompok nya yg melakukan pemalsuan e KTP karna merupakan penghiyanat bagi bangsa dan negara
"Tangkap Ahok Sekarang Juga, Share Jika Setuju !!!"
"Sayang sekali Bangsa ini Paling jago kalau merasa-rasa. Yg mendukung Pak Ahok merasa paling benar, yg mendukung Mas Anies merasa paling suci"
Video Ahok Menghina Agama Kristen Agama Konyol #AhokPecahBelahBangsa
"Bukan Hanya Penista Agama, Bagi JPU Ahok Pemecah Belah Bangsa https:\/\/t.co\/6qkIFCjqhq"
Mbak Sylviana please Anda sehat? #DebatFinalPilkadaJKT #perjuanganbelumselesai
Nomor 1 sok tau lagi lansung di skak wkwkwk #DebatFinalPilkadaJKT
RT @Gemacan70: Ayoo jaga keutuhan NKRI!!! Tangkap Penista Agama!!! #StopKriminalisasiUlama https:\/\/t.co\/dxIDQ4ZQHV
"@Lupuz0503: Terlihat salah satu pendukung mafia koruptor dan penista agama, para gerombolan BANCI TITOT lakukan bidikan ke arah"
tobat yuk sebelum terlambat. biar gerombolan JIL aja yg kita doakan konsisten bela kekafiran hingga akhir hayat https:\/\/t.co\/979uJ6ItrM
"RT @UstadTengku: Ya Allah Jika Mereka Menempuh Cara2 Curang utk Memenangkan Si Penista Agama, Engkau Kirimkanlah MALAIKAT MAUT Utk menyeles\u2026"
;Kebanyakan fitnah nih mpok silvy #DebatFinalPilkadaJKT #Gue2
"FPI: Pendukung Ahok kalah jumlah, dengan izin Allah kita gusur Gubernur koruptor dan penista agama https:\/\/t.co\/Jp7pGLRGiE"
#JakartaBanjir Pemimpinnya gak punya akhlak yg baik... PENISTA AGAMA. https:\/\/t.co\/PNEGDJMPCH
"RT @felixsiauw: tapi twit begini asik lo, kita jadi tau yang mana akun-akun pro-penista agama, akun-akun buzzer yang kerjanya menghujat :)"
@DivHumasHansip: ahoker siap bela penista agama https:\/\/t.co\/HxuU4rUDFX\
RT @alwinazar24: sepertinya CUCUnya DAJJAL telah hadir
"Mereka Siang MALAM Maki2 Ulama Kita, Nongkrongi Medsos Ulama2\nBela PENISTA Agama yg SOMBONGNYA Minta AMPUN."
RT @Jhonkosmik: Ada apa dengan mayoritas etnis China di DKI?\nMengapa begitu solid mendukung penista agama Islam?\n\nDendam?\nTidak nasionalis?
Mukanya mpo Silvy Asem bangett ngakak kena deh abis jahat sih #DebatFinalPilkadaJKT
RT @GodinJ760478: @tempodotco gara2 belain terdakwa penista agama jadi remek semua. Sukurin
"RT @Chaeruddin_B: Sekumpulan Teman Penista Agama\nTdk ada empati buat korban banjir, hanya koar2 memuji junjunganya https:\/\/t.co\/XQFktDG74x"
RT @TerorisSocmed: PENJARAKAN PENISTA AGAMA !!! ATAU @jokowi TURUN !!! https:\/\/t.co\/vqH0TNXaRz
"Si penista agama, Jaga mulut aja gabisa apalagi jaga jkt?"
Ahok : program paslon no. 1 ini programnya ngambang | yaiyalah pakkk gak ada program diaa cma ada celaan #DebatFinalPilkadaJKT
Akui saja Ahok dan Djarot kalian gagal atasi banjir.Orang kena banjir anda sibuk sidang kasus penista agama
RT @87_julay: Iyaa... Ahog Ngak pantes jadi pemimpin.. Pantesnya penista agama dipenjarakan!!! https:\/\/t.co\/YhhO40QWXS
RT @wongawas: Overdosis @Metro_TV membela penista agama. https:\/\/t.co\/i84RARpy5w
"Kaga masuk diakal kite kalo suara seorang penista agama yg dah dikutuk ame umat islam suara nye bisa tinggi, emang sengaja ditinggiin tuh"
RT @andreobz: Pantasan di pecat dr menteri...data2 aj ngawur dan memkasakan betul..hahaha #AhokPastiTumbang #paslon3 #pilgubdki
RT @BangsaPenguasa: Penjarakan ahoax penista agama atau jokowi turun.#KonsolidasiDewanPKB https:\/\/t.co\/XoW5eakIsk
"Napa dibiarin tim si penista agama maen curang maren, emang sengaja dibiarin biar ntar digaplok umat islam rame2 se jakarta tuh penista"
Hahahahhahaa silvy ohh silvy cacingan amat loe ahhh wkwkwkwkwkk #DebatFinalPilkadaJKT
"RT @Rakyat_Angin: Ahok Taik. \""MENFITNAH\"". Emang lu tukang caci maki perempuannn!! Asuuu #AhokPastiTumbang #DebatFinalPilkadaJKT"
RT @HasanArisandi: #AhokPastiTumbang fakta di bilang fitnah\n#DebatFinalPilkadaJKT
"Shame on you silvy !! Ga malu fitnah?? Tuh rasain pak ahok panas, skak mat #DebatFinalPilkadaJKT"
Bu silvi anti pns level rendah katanya #DebatFinalPilkadaJKT
RT @AnnisaFYtr: Hanya Orang Islam Yang Bodoh dan Goblok Yang Memilik Ahok! #DebatFinalPilkadaJKT
"@DivHumasHansip: fitnah FPI pecah adalah ulah ahoker yg melihat elektabilitas ahok tinggal 10%,mereka kelojotan melihat MUI+NU+Muhammadi"
Norak banget iklan mantan mendikbud @aniesbaswedan ini. Tambah gak respech.. inilah tenun kebangsaan yg dia maksud.\u2026 https:\/\/t.co\/Ux7HEYkBLG
"RT @DivHumasHansip: yg nebar kebencian itu ahok mbak,masa mbak gak tau sih sampai dia jadi terdakwa loh @AnizzahGedrun"
pertanyaan dari Bu Sylvi gak mutu amat. #DebatFinalPilkadaJKT
Huuu sylvi tak tahu apa-apa asal ngoceh #NobarAhokDjarot #DebatFinalPilkadaJKT
Sylvi keliatan bloonnya #DebatFinalPilkadaJKT
RT @WanitaRevolusi: Ahoax penista agama kembali mengolok olok surat AL-MAIDAH 51. Cc @Dahnilanzar
#JakartaBanjir Pemimpinnya gak punya akhlak yg baik... PENISTA AGAMA.
#DebatFinalPilkadaJKT mati kau hok
Yg ga punya program bisanya cuma fitnah. Ciri Orang yg demen ngambil kjp kontan #DebatFinalPilkadaJKT
Mpok silvi nyinyir melulu pertanyaan nya tapi sayang sesat! Maklum sih dese emakemak! #DebatFinalDKI #DebatFinalPilkadaJKT
RT @bajigurceleng: @jpnncom hahaha jelas2 buat pilkada dasar polisi made in cina pelindung penista agama
Kurangnya pemberdayaan wanita DKI Jakarta bisa dilihat dari telaknya perbedaan warna muka dan warna tangan mpok sylvi #DebatFinalPilkadaJKT
Agus silvy Tukang Fitnah #DebatFinalPilkadaJKT
#DebatFinalPilkadaJKT yaudah gus sini kalo ga sakit secara fisik daripada verbal gw gebukin lo rame2
Keluarga kita gak ada yg maling coyy gak perlu trauma kaleeeee emang kluarga ente?
JG KAITKAN JOKOWI DENGAN AHOK KATA JOHAN BUDI. KATA KAMI. SEBAB JOKOWI ANJING. SEDANGKAN AHOK BABI. YA JELAS BERBEDA. WALAUPUN OTAKNYA SAMA
Bajingan lu silvy #DebatFinalPilkadaJKT
"Hasil Akhir, Menyatakan @jokowi Melindungi Ahok TERDAKWA PENISTA AGAMA !!!"
RT @SiBonekaKayu: Selepas banjir Jakarta 212 Pendukung Ahok mengganti narasi doa. Semua demi keuntungan Sang Penista Agama
Tionghoa katanya kaya? Kok pada putus sekolah? Kebanyakan dugem?
Gusur Ahok demi Indonesia. Teladan buruk pembangkangan hukum dan anti kemanusiaan di Jakarta jgn tertular ke daerah. #CoblosPecinya
"BUAT AHOKER YANG TAKUT MATINYA GG DISHOLATIN , TENANG ADA ABU JANDA UST GADUNGAN YG SIAP SHOLATIN AHOKER & JOKOWER"
Mampuuss ! Di tembak dalem banget silvyy .. lo urusin tuh dapurr ! Gak punya program demennya nyerang terus !!! #gue2 #DebatFinalPilkadaJKT
Anjir baru kali ini lihat orang bego mau debat pilkada. Kerjanya nyerang karakter. Shame on you mpok silvy and agus. #DebatFinalPilkadaJKT
Uang Taipan tuh. Nanti dibayar dengan ratusan penggusuran biadab oleh Ahok.
CINA ASU https:\/\/t.co\/zM1BsjAIHA
"Ketika ngomong, Sylvi keliatan oke. Tapi begitu didebat Ahok, Sylvi langsung kekuatan goblok."
"Jangankan Banjir, Tuhan aja Dilawan Sama Ahok #JakartaBanjir Tapi Jakarta hari Ini Bukan Banjir, Hanya GENANGAN."
ADA PEMIMPIM PRIBUMI knp pilih PEMIMPIN IMPOR yg g BERADAB tukang BERBOHONG yuk PRIBUMIKAN DKI milik BANGSA IND @Gemacan70 @TerorisSocmed
Karna dia ga punya program hanya modal bacot doang
Pendukung berarti dia bagian dr penista agama tersebut!!! Dukung gerakan ini 100%
Narkoba yg paling berbahaya adalah ILUSI KESUCIAN AHOK SANG PENISTA.
@tribunnews emang ahok siapa?? Orang penting?? Dia hanya penista agama!!
cina mah duitnya dari hasil maling di Indonesia di balikin lgi berkedok invest plus bawa gembel2 & napi dari Cina negeri nenek moyang ahok
"Tangkap Ahok @basuki_btp skrng juga, koruptor reklamasi Jakarta dan penista Agama Islam."
keliatan banget bego nya mpok silvy and agus. #DebatFinalPilkadaJKT
"Yg Ahokers, Klo gak seneng ama cuitan gw silahkan unfollow krn gw Anti AHOK (Si Penista Agama Islam)"
AGAMA DI NISTAKAN! ULAMA DI LECEHKAN!! Ini Alasannya #HaramPemimpinKafir
RT @FredyBastian3: Cara serang Ahok : Kafir galak
@umnia77 @ruhutsitompul @sahal_as anjing2 ahok.kaum babi lo bnyk bacot.mnding duel sma gw.
Ahok memang verbalnya keras. Pelampiasan dan pelarian karena kelelakiannya lunak.
"yg maling itu kan china2 babi BLBI , korupsi nya triliunan , termasuk si AHok korupsi 2 triliun.."
Mimpi djan farid jakarta lebih islami dari aceh jika ahok terpilih itu ibarat babi merindukan halal
@KompasTV @ridwankamil ridwal kamil memang hebat dan top nggak kaya ahok tukang penista agama dan koruptor
@TPK_RI ITULAH si ahok kutil babi
Dasar si Kutil babi ahok memang Tukang Bohong. selain Bohong ahok jg biasa Menyalahkan yg lain menutupi Kegagalan nya . contoh soal banjir
@PonkEcha @Fahrihamzah Si Terdakwa Penista Agama Alias Si Ahok Babi Jamban tuh yang Morfotin Uang Rakyat Jakarta
"Om...Ahoknya...Mana Om,Katanya Si BABi Ahok Bisa Ngatasi Banjir...Om...BABi Jgn Membual Om...?!!?"
kenapa anak babi jalan nya nunduk???karena malu liat ulah bapak nya yang ngebelain ahok..
Perilaku Si BABI @jokoanwar ini memang benci dgn hal berbau Islam. Cocok dgn Ahok. @SiBonekaKayu
@budimandjatmiko ahok si kutil babi kembali ke rumah lembang kenapa jakarta jadi banjir bud?
"#jujur orang cerdas dan pintar pilih orang imam dan mampu memimpin ..bisa sholat...bisa ngaji..santun, sopan..tidak seperti babi kafir ahok"
Teman Ahok emank TAI. apalagi pemimpinnya kek BABI! @temanahok
"Mana para babi ahok yg ngejek onta, biar di injek2 ama onta"
@gotcancer2 bukannya stigma babi itu milik tuhan elu si ahok kafir
Kampungan ya pendukung AHY https:\/\/t.co\/GmezpOYLsY
"@Ananda_harahaP udah lu jgn panik gitu. ahok si kutil babi bakal tumbang kok di putaran kedua. teruskan cuapcuap mu di sosmed, gak ngaruh."
"ahok tidak layak seperti manusia, dia lebih tepat seperti babi yg tidak punya akal pikiran dan jiwa manusiawi"
@haloJakarta Ahok (BTP) Basuki Tai Babi
"RT @diyahaudya: @yusuf_dumdum Yg ada, cacimaki penista agama tapi ternyata ketauan poligami ngumpet2. Apa mau digituin? Saya sih ogah."
"@adichandramang2 @CummaRachel @korban_gusur iya , trump memang penista agama atau anti islam emang hubungannya dgn anis apa?"
@adichandramang2\nAda aseng KOPLO pembela si PENISTA AGAMA yg durjana nyuruh org lain ngaji!
"@bayprio Itulah kebodohan para penista agama, sudah saatnya pilih pemimpin yg mengerjakan shalat 5 waktu"
@iwanfals pilih Anis sandi doong..jgn pilih si penista agama pemecah NKRI
"@posmetroinfo Emang terdakwa penista agama, salahnya dimana coba, kl yg biasa bikin hoax metrotipu aman2 aja tuh dewan peres"
@RamadanMalka Pamor RK jadi seakan tak ada artinya jika parpol pengusungnya pendukung penista agama...
@RestySeterah si ahok pantasnya dinobatkan sbgai Babi ngepret
"@roninpribumi @dewanpers yg salah itu mereka menulis TERDAKWA PENISTA AGAMA,coba klo ditulis BAGINDA YANG MULIA pasti ga masalah..cuih.."
Faktanya Cina2 parasit tuh ngotot belain si penista Agama @PradanaBhakti @IrianaPasirua @PutraSumedang18 @khoirulilham12 @ronavioleta
jokowi ratu adil apaan..??? dia ga ada keturunan darah biruadanya DARAH KOTOR cina babi..!!! https://t.co/JtwFRRdLF4
RT @RestySeterah: Keren nih apps kawal TPS .. Yuk gabung buat pastikan cagub terdakwa penista Agama lebih cepat diantar kehabitatnya
"Kalau lo gak tau apa-apa ya jangan berkoar sembarangan dong, keliatan banget kalau lo itu beneran bego :)) #FuckYou"
@AHMADDHANIPRAST ahmad dhani yang terhormat paling babi paling anjing aing kontol paling lonte tungu saat nya karier mu akan habis!!!!
"Kang @ridwankamil ,fakta hari ini,partai pendukung si penista agama sangat dibenci rakyat,termasuk rakyat Jabar. https://t.co/b2WetyvrbZ"
"plis jangan sok kecantikan selalu pacarin artis2 yang lagi meletek, jijik gw liatnya"
"paling mau muntah liat lagak nya @AHMADDHANIPRAST, jadi orang sok iye banget hoek"
@Metro_TV kalau boleh saya ngomong ingin saya katakan ahmad dhani monyet babi anjing. tapi itu tidak boleh
"perempuan kaya lo mending mati aja deh, jelek aja, gausa sok jadi make up artist!"
"ahmad dhani itu borok, sampah, babi, anjing. Saya adalah orang pertama yg sangat muak liat muka dhani dan saya berbangga."
Lah emang sdh jelas2 si ahok terdakwa penista agama. Malu woy! https://t.co/2K0HlMpR9t
"Keputusan ERKA hari ini harus kita HORMATI, begitupun sebaliknya KAMI tidak akan memilih partai pendukung PENISTA AGAMA."
Lupakan @ridwankamil biarkan karam dg kapal munafiknya. kita bangun jabar dg kapal yg bersih. Delete partai pendukung penista agama dari hati
Masalah dunia dan masalah nafsu ya kang @ridwankamil . Kata2 kok bersayap kayak burung hantu. https://t.co/mwClbkU4sT
Penista Agama menjadi Santri Kehormatan.Yang kasih ini ke ahok otaknya perlu direparasi.Demi Pulkada nama Santri yg baik kailan jual belikan
"Payah banget @ridwankamil maju Jabar1 pakai partai Nasdem pendukung penista agama, ente lagi butuh uang ya kang? Payah loe!!"
"polisi yg jadi imam sholat ini adalah seorang penista agama, bodoh, BERISLAM cuma ikut2an. COPOT KAPOLRES JAKBAR !! https://t.co/s2h2Ybrthm"
"RT @ferdyfrodoo: @bayprio Itulah kebodohan para penista agama, sudah saatnya pilih pemimpin yg mengerjakan shalat 5 waktu"
"RT @Ra_Ria_Rana: GAK HABIS PIKIR???\n\nTINGGAL NUNGGU ADZAB ALLAH NIH NEGERI,,,, PEMIMPINNYA SDH DZALIM https://t.co/UmZK4bTyi4"
"Sini lu, kami enggak mau kampung kami didatangi sama penista agama, https://t.co/1z3MtHs9ck"
"SETUJU SAYA,KLAU AHOK DAPAT GELAR SANTRI KEHORMATAN.... TAPI SANTRI KEHORMATAN BABI.... https://t.co/uD16d7Gwhd"
Senang dong ada yg fans mati sampai lupa kalau dia bego banget https://t.co/ctJFC5a8Zz
@AHMADDHANIPRAST LO TUH BABI ANJING. Mampus kalah jatuh miskin deh #bekasisah
@bayprio : Si AHOAK @basuki_btp CINA ANJING KAFIR PENISTA AGAMA ISLAM....!!!
"@AHMADDHANIPRAST aku katakan anjing kpd ahmad dani, boleh....aku katakan babi kpd ahmad dhani, boleh..."
"@Bisniscom haha memaki untuk melawan mah harus, drpd ditindas pemimpin munafik melindungi penista agama, dll. Agama no 1 (islam), taubat rot"
"@Anakran63208433 @5ec4a1e80d3c48c @aniesbaswedan pikiran anak bani kampret g beda jauh sma penista agama. Penfitnah, Penipu Dan Garong.."
@Gemacan70 itu yg cewe pake kerudung ngapain ya? Setiap kali konfrensi pers ada aja.. Pencitraan Islami kaliiii... Bwahaha..!!
@republikaonline spt ahok dulu .. nasdem disusul dg cs nya .. yg mendukung paslon penista agama dan tukang caci maki tai tai ..
@topan_julian1 kalo mecin jangan dijadiin cemilan mangkannya kang. Jadi begonya bego banget.
@ulinyusron cm didoain kalau saya mah ketemu si penista agama langsung saya ceburin laut yg direklamasi ijin sembunyi2 buat tumbal reklamasi
"@ymerdeka33 @ach_qodr @basuki_btp cabe2an bisa nya hanya bbm.n facrbook.n!! Masalah politik mana tau doi, tau nya berita2 sampah pencitraan"
INI MANUSIA APA ANJING MATI-MATIAN RELA JADI MURTADZ DEMI BABI AHOK KAFIR. https://t.co/2XXN5CFdVM
"ini semua berawal dari AHOK JAMBAN yg dibela aparat, para kristen serta china kafir yang lain semakin berani menghi https://t.co/qUutkrlsP3"
"Kami lebih resah anda jd presiden!!!! hidup anda penuh drama dan pencitraan, main FTV aja joko judulnya https://t.co/T2BUgLTnUO"
"Mana bisa percya lagi,sdgkan induknya penista smp skrg lum ditahan tp malah dibela. https://t.co/Oc1vGdX0Z4"
Mari seluruh Muslim CYBER Army mulai skrg ganti semua sebutan A....K menjadi Terdakwa Penista Agama !
"Orang Islam lebih suka si HOAX penista agama, menjaga lisan dan tindakan dari hal-hal yang merusak hubungan... https://t.co/FLhW31wXdU"
RT @izzah_pandeka: #Nomor2Koruptor negeri para korup diasuh cino babi https://t.co/wJXalyPxPn
RT @Gemacan70: Hajar bleh hanya untuk bela #Nomor2Koruptor...cuihhhhhh https://t.co/o4nnZBkNYS
RT @korban_gusur: @RakyatBiasa1945 Ada CEBONG GENDHENG NGAMUK2 belain si HOMO PENISTA AGAMA!! HAHAHA @OshMuslim @RebusKentang @m3g4
RT @Ustadtengku1: @RizieqSyihabFPI tolol itu banyak yg bela penista agama walau sudah tersangka
Orang punya saksi anjing dikasus babi.. Tolol https://t.co/ssePg5FCXm
Si Ahok kampret emang gak becus kerja. Pencitraan mlulu tuh si Ahok kampret. https://t.co/yM5ViOFvpc
"Sini lu, kami enggak mau kampung kami didatangi sama penista agama, https://t.co/1z3MtHs9ck"
"Tanda2 kiamat x yak, masih banyak aja orang muslim yg mengingkari Al-Quran dan pilih Penista Agama. #Nomor2Koruptor #Nomor2Koruptor"
"#JanganMauDibohongiAhok sebab Ahok Sumber Kekacauan Politik, Ramaikan Aski 313 FIGHT!! https://t.co/WOBxlxvZnx"
#MataNajwaDebatJakarta Anies anda SADIS. Topengmu terbuka lebar malam ini. Biar warga DKI yg menilai...apa yg anda katakan adalah PENGECUT
Anies congornya aja gede. Realisasinya gak ada. Janji terus dari awal bisanya paling korupsi. Balik jadi dosen aja bangsat.
"#MataNajwaDebatJakarta Hebatnya, Ahok masih mau salaman loh sm Pak Anies yang Amat terhormat. Idih gw sih ogah."
#MataNajwaDebatJakarta kalau untuk urusan bacot memang anis nya juaranya..memang kita bakal makan bacot di jakarta..haha..paslon yg aneh gede bacot doang.
#MataNajwaDebatJakarta pak anies banyak omdo dulu waktu jd menteri terobosannya apa?? skrg ngomong ky sok Jago bgt
#MataNajwaDebatJakarta si Cina Babi ahok bloon banget. Sok pinter banget lagi. Asal bukan Ahok
#MataNajwaDebatJakarta lucu banget jawaban ahok.. gak nyambung. Ditanya apa di jawab apa. Kena skak mat d pertanyaan isu agama tdi. Dasar cina tolol hahaha
#MataNajwaDebatJakarta topeng anda hari ini fix terbuka @aniesbaswedan .. anda sama dgn yg mendukung anda.. BAU BUSUK
"#MataNajwaDebatJakarta Pak Anies suka nyinyir, suka memutar balik kan fakta, ga punya program yg jelas bisanya jelekkan kinerja pak Basuki"
Babi... iya memang si Ahok gak jauh kayak Babi..
Si tengkuk babi sipit bangke agen dajjal mau jadi onta hahaha. Orang waras juga tau kasus ahok dipaksakan!!
itu kan kata ahok kafir..umat islam anti ahok karena ahok itu kafr ditambah ahok itu cina yg suka makan babi & bir
"gw harus bilang Babi Ahok apa dong selain kafir, gw hanya pengen gerombolannyA Babi Ahok merasakan bagaiamana klo di anjing2in, Bangsat2in"
"sibabi china sangat biadab memperlakukan kaum PRIBUMI, dan para jongon2 spt banser & nu nusantara mendukung ketimpangan ini, biadabnya mrk!"
ahok kafir takut debat dengan rakyat asli pribumi nelayan dan para pakar reklamasi dari rakyat.. ahok kafir bencong
nampaknya sudah satu paket penyokong cina babi pasti juga sokong LGBT
kebiadaban ahok cina kafir anak2 rakyat kecil pribumi dan ibu2 islam semua digusur dari rumahnya serta kehidupannya
"tim ahok yg otak wc otak tumpul justru anies itu sdh komit sekali dgn pancasila ,ahok kafir sgt tdk bs berpancasila"
"#MataNajwaDebatJakarta Pak Anies sudah meninggalkan ketenangan dan ketulusannya dalam debat malam ini, mjd agitatif dan licik. semoga kalah kau anjing"
"SELAMA PROSES #SidangAhok WASPADAI ULAMA2 KUBU AHOK..YAKNI ULAMA2 ""MUNAFIK"" YANG SESAT DAN MENYESATKAN..!!"
anies akan merangkul dua2nya untuk persatuan tidak spt ente dangkal & cekak intelektual hanya jadi budak ahok kafir.
"kebiadaban ahok cina kafir rakyat kecil yg jadi PKL & asongan2 digusur2 dan dianiaya spt teroris, ahok kafir biadab"
RT @LeonartoRabono: tapi kenyataanya jutaan rakyat kecil asli pribumi yg miskin justru semakin dimiskinkan oleh ahok cina kafir....
Itulah Indonesia. Yg dibully org yg bener.Yg salah dan binatang2 seperti nomor tiga dibiarin berkeliaran #matanajwadebatjakarta pak an https://t.co/jYSg6x1A
"#SidangAhok smg sipenista agama n ateknya matinya tdk wjar n jasadnya tdk dtrma tnh n dia tdk prnh mrs kn sorga,aamiin semoga tuhan setuju"
"iya,kelasnya penista agama,bs nya cm ngebacot doang yg arogan sk blg taik"" nenek lu,oh ya sumber waras n nama d kasus E ktp apkabar?skakmat"
Penjarakan semua cina kafir dan ateis! Termasuk Ahok pemimpin babi tukang korupsi!
Kampanye rasis ngmg nya pihak ahok yg di untungkan.. Goblok kafir mana ada di untungkan.. Kalau pada di perkosa bunuh lu enak berduit
hahaha idiot bilang kpd orang2 kafir terurama para nasrani pendukung2 ahok kafir jangan memasuki wilayah2 syariat islam
I HASIL MAKMAK KALIAN JUAL PUKINYA. BAGI KSLIAN YG BERPIHAK KEPADA PKI DAN SI AHOK ANAK CHINA ANJING KAFIR INI. SERTA NKRI BUKAN DIDAPAT
"Tim pendukung sakit jiwa, kehilangan akal sehat & ide #IklanAhokJahat"
#IklanAhokJahat Hati hati Mereka Mulai Prustasi dan Memainkan Cara cara Kasar !! Karena hasil dari berbagai survei si penista agama kalah!!
"HOOKK, masuk gorong"" aja loe #IklanAhokJahat"
Kayak gini nih kampanye Tim AniesSandiUno ke kampung2 mengintimidasi masyarakat. Kampungan ye? #ASUtenan
SI KUTIL BABI TELAH MELECEHKAN PRIBUMI DAN UMAT ISLAM #IklanAhokJahat
NGOMONG AJA ENTE SAMA KACA! MEMECAH BELAH KERUKUNAN LAGI HOK ENTE BISANYA. NGACO! #IklanAhokJahat
"#iklanahokjahat Terorist nyata di Indonesia... Bukan wahabi, bukan Onta Tapi Babi Babi milik Cina Penebar Teror sesungguhnya...."
"RT @TerorisSocmed: Sadarlah wahai anak Bangsa, Ibu Pertiwi Sedang Diporakporandakan Oleh Manusia BIADAB @basuki_btp Sebagai Aktor Utama"
"Sepertinya gerombolan @basuki_btp rindu kerusuhan, hati2 dikabul Tuhan #IklanAhokJahat"
Ahok and Bani serbet and wereng Coklat MEMANCING UMAT MUSLIM supaya marah? dengan #IklanAhokJahat. KALIAN ITU KUMPULAN ORANG SINTING
"#IklanAhokJahat baru ada direzim jokopret,setan,iblis,dajjal dibangkitkan dr kuburnya. Mereka gembira berpesta pora setelah lama dibelenggu"
Yang anti cina & mau ganyang cina tuh siapaaaa..??? kami cuma anti AHOK sang Penista Agama! #kampanyeAhokJahat #IklanAhokJahat #kampanyeSARA
Udah bingung kalik mau pakai cara apa untuk kampanye. Sampai2 bikin fitnah yang kayak begituan. Depresi ya takut kalah? #IklanAhokJahat
Tahukah Anda apa persamaan antara malin kundang dengan Ahok? mereka berdua sama-sam DURHAKA!!!!!!! #ASBAK #iklanahokjahat #kampanyeahokjahat
"HADUH KELAKUANMU HOK, SOK-SOKAN MENJAGA KEBERAGAMAN PADAHAL PROVOKATOR & RASIS!! #IklanAhokJahat"
RT @sarwandi_sr: #IklanAhokJahat bikin darah mendidih. bangsat penuh dengan propaganda. emang lo kira islam radikal ?Kalau kami mau
Kapolda Babi! Biadap dan Bodoh! Gak punya otak kali.
"Jangan2 lagi deh @basuki_btp hina islam, anda itu manusia hina dibandingkan agama yang mulia, anda bukan siapa2 & bukan apa2 #IklanAhokJahat"
AHOK KAFIR DAN BUDAK2NYA ATAU ANJING2 NYA HANYA SEBAGAI SAMPAH AGAMA ISLAM DAN SAMPAH MASYARAKAT
umat agama islam dijakarta sangat haram dan sangat najis sekali dengan ahok kafir kristen...
19 april CNN kibarkan bendera kuning atas kematian ahok-djarot....
itulah akibat ulah orang2 kafir nasrani persis seperti ahok kafir yg melarang jilbab kepada anak2 sekokah di jakarta....
baswedan pantas jadi gubernur jakarta dan komisioner KPK..... ahok kafir pantasnya jadi germo di alexis....
"RT @yudijannis: #IklanAhokJahat bagaimana klo kita ganyang beneran hok?itu sih maunya elo ya hok,adu domba pribumi dengan tionghoa!!jangan"
masalahnya djarot tidak bisa memikirkan rakyat kecil pribumi bisanya hanya membabu kpd cina2 betul2 songong jongkok.
"otak wc otak babi yg menerima ahok kafir & kamu, ahok kafir bkn sekedar menghina sdh anggap islam itu sampah"
"DALAM PUTARAN DUA NANTI JIKA SAMPAI AHOK KAFIR CURANG UMAT ISLAM SUDAH KOMITMEN JAKARTA AKAN DIJADIKAN LAUTAN API, SUDAH TIDAK MIKIR HUKUM"
#IKLANAHOKJAHAT AHOK MENCIPTAKAN BARA API ANTARA RAKYAT PRIBUMI DENGAN TIONGHOA YG DIBALUT DENGAN PHOBIA.... AHOK KAFIR RASIS...
jangan heran pemerintahan jokowi sekarang ini budaknya kulinya cina2 ahok kafir dan 9 naga...
Ya itu namanya cawgub goblok gak ngerti peraturan debat....kelihatan bego dan liciknya itu sandiaga uno.
BODOH jika para pendukung ahok yg Muslim tidak tersinggung sama sekali ! Tapi bisa aja sih Qur'an d hina saja mrka diam #IklanAhokJahat
Gubraaaaak!!!! Malu liatnya... Untung semalem debat ga kaya MATA NAJWA.. Coba kalo formatnya sama pasti Ringsek dah pasangan ASU...
YG JELAS OTAK AHOK-DJAROT SUDAH SANGAT TUMPUL SANGAT LOYO DAN STRESS..... SUDAH JEBOL HARUS DICOPOT DAN DIGANTI.....
"AHOK KAFIR BUKAN HANYA MALING TAPI JUGA GARONG, LAHAN LAUT MILIK NELAYAN DIRAMPOK & DIRAMPAS UNTUK REKLAMASI YG MENGUNTUNGKAN CINA2 KAFIR.."
Sumpah bego bgt sih kesel gue. Kenapa ada org yg vote makhluk kayak Sandiaga Uno coba. Oh agama
"responden2 yangg goblok2 belum faham & juga wartawan beritasatu juga goblok, nanti klo anies-sandy sudah memimpin sangat mudah"
