"FPI RENOVASI MASJID ITU SANGAT TEPAT, AHOK KAFIR KRISTEN NGAPAIN NGURUSI MASJID2 APA HUBUNGANNYA....."
MENGAPA ahoker KRISTEN & MUNAFIK tidak berhenti mengolok2 GEREJA stiap hari? Apakah mereka memang dibriefing ahok untuk menghina si BUMI DATAR?
uma surveynya si Botak yg menangkan Ahok. Karena apa? Karena dia Cina Kristen. Bukti kalo si Botak dukung sesama Cina Kristen
"AHOK PEMECAH BELAH UMMAT, AJARAN KRISTEN KONYOL, demi meraup suara muslim, JELAS AHOK INI RASIS, PKI TULEN"
Woy @aagym lu udah nonton yang ini? Fitnah? Pale lu peyang gym. https://t.co/U3QhuJpwg
"Ahok :memilih pemimpin Berdasarkan agama melanggar konstitusi. Sebaiknya BABI INI DI BUNGKUS aja, CONGORNYAPECAH BELAH UMAT BERAGAMA."
"Saya pribumi, Kristen dan mendukung Ahok. Tapi saya paling anti dengan manusia2 bodoh dan goblok seperti Steven Hadisurya Sulistyo."
"Maksudnya terbukti KORUPSI dan PENISTAAN agama nya ya om, Bangsat lo, TAIK LO, maaf gw pake Bahasa Babi Ahok."
"Ehh TAIK, Bangsat lo, Omongan elo kayak IwAn bopeng, yg MO potong leher TNI, Bangsat lo IwAn bopeng, baek2in TNI. TAIK LO,"
"Ehh anak anjing Ahok, Kelan itu blon siuman, mending emut2 bool basuki lagi aja sana, kasih tau sama Babi yg lain, bool basuki wangi gitu"
CWE CAKEP TP BEGO.PANTES GK LAKU.SI AHOK CINA BAU TAI.MAKAN BUBUR ENCER.AHOK FAHAM KOMUNIS.MENISTA ISLAM & KRISTEN
"Dan ajeng pasti paham si Babi Ahok klo bicara santun, BANGSAT, TAIK, ANJING, SETAN LO, dngn intonasi yg familiar tuntuna"
"Itu dia, BUNUH AJA YG DIDEPAN MATA, DIA MAFIA KORUPTOR NYA, PENISTA AGAMA PULA, PANGGILAN POPULAR NYA BABI AHOK"
Gimana dgn Sumber waras.. Trans Jakarta ko jokowi diem ajah.... Harusnya si kutil babi ahok di ganyang
Muka Si BABi Ahok Tuh Yg Mirip SERBET Lantai....@basuki_btp...
"Betul bang hancurkan merka bang, musnahkan china babi dibumi pertiwi indonesia, berkedok reklamasi itu ahok"
"Sapa Yg bilang Ahok anti korupsi!?, klo grombolannyA NGOMONG gtu wajar, AHOK ITU MAFIA KORUPTOR SANG PENISTA AGAMA YG DILINDUNGI ISTANA PKI"
"Gw juga ngimpi SENTILIN BIJI BABI AHOK, pcetar Pcetar, langsung kejang2 die, ngadu ke Jkw, Jkw: makanye sunat dulu, bru NGOMONG Almaidah."
Mudah2an gw ketemu sama SI BABI IWAN BOPENG DI TPS nya anjing Ahok
